<?xml version="1.0" encoding="UTF-8" standalone="no"?>
<!DOCTYPE cv SYSTEM "exo_cv.dtd">
<cv>
    <titre>Monsieur</titre>
    <cvnom>Philippe STONS</cvnom>
    <etatcivil>
        <nom>STONS</nom>
        <prenom>Philippe</prenom>
        <naissance>top secret</naissance>
        <situation>tout le monde s'en moque</situation>
    </etatcivil>
    <formations>
        <formation date-iso="1900-01-01" date="Aujourd'hui" intitule="Ecole maternelle" />
    </formations>
    <connaissances />
    <professionnel>
        <experience date-iso="2000-09-01" date="Aujourd'hui" entreprise="UNS" fonction="Professeur">
            <missions>
                <mission>recherche</mission>
            </missions>
            <environnement>
                <technique type="5" nom="EPST" />
            </environnement>
        </experience>
    </professionnel>
</cv>